{"result_version":"1","status":"success","operation":"validate","run_id":"demo","hashes":{"scenario_sha256":"a56b9b38f18d93e2953f90c8b052026d174e91c01a9465f8070a22040820a78d","journal_sha256":null,"strategy_transcript_sha256":null},"counts":{"instruments":1,"schedule_batches":2,"slices":4,"audits":29,"orders":3,"active_orders":0,"filled_orders":2,"rejected_orders":0},"valuation":{"base_currency":"USD","cash":"9846.979929","net_market_value":"265","long_market_value":"265","short_market_value":"0","gross_exposure":"265","cost_basis":"257.154644","realized_pnl":"19.134573","unrealized_pnl":"7.845356","equity":"10111.979929","dividend_pnl":"1","execution_fees":"2.907896","borrow_fees":"0.25","total_fees":"3.157896","cash_balances":[{"currency":"USD","amount":"9846.979929","fx_rate":"1","base_value":"9846.979929","interest":"0.285075","base_interest":"0.285075","settled_amount":"9846.979929","unsettled_amount":"0","base_settled_value":"9846.979929","base_unsettled_value":"0"}],"positions":[{"instrument_id":"demo-equity-acme","quote_currency":"USD","quantity":"2.5","mark":"106","fx_rate":"1","market_value":"265","base_market_value":"265","cost_basis":"257.154644","base_cost_basis":"257.154644","realized_pnl":"18.849498","base_realized_pnl":"18.849498","unrealized_pnl":"7.845356","base_unrealized_pnl":"7.845356","dividend_pnl":"1","base_dividend_pnl":"1","execution_fees":"2.907896","base_execution_fees":"2.907896","borrow_fees":"0.25","base_borrow_fees":"0.25","total_fees":"3.157896","base_total_fees":"3.157896","execution_fee_components":[{"name":"broker","kind":"fixed","currency":"USD","amount":"0.75","quote_currency":"USD","quote_amount":"0.75","base_amount":"0.75"},{"name":"exchange","kind":"notional_bps","currency":"USD","amount":"1.664894","quote_currency":"USD","quote_amount":"1.664894","base_amount":"1.664894"},{"name":"maximum_adjustment","kind":"maximum_adjustment","currency":"USD","amount":"-0.006998","quote_currency":"USD","quote_amount":"-0.006998","base_amount":"-0.006998"}],"settled_quantity":"2.5","unsettled_quantity":"0"}],"execution_fee_components":[{"name":"broker","kind":"fixed","currency":"USD","amount":"0.75","quote_currency":"USD","quote_amount":"0.75","base_amount":"0.75"},{"name":"exchange","kind":"notional_bps","currency":"USD","amount":"1.664894","quote_currency":"USD","quote_amount":"1.664894","base_amount":"1.664894"},{"name":"maximum_adjustment","kind":"maximum_adjustment","currency":"USD","amount":"-0.006998","quote_currency":"USD","quote_amount":"-0.006998","base_amount":"-0.006998"}],"cash_interest":"0.285075","settled_cash":"9846.979929","unsettled_cash":"0"},"artifacts":{"journal":null,"strategy_transcript":null}}
